Name,Latitude,Longitude,Address,id
Vàm Láng,10.41291129946026,106.77252889999998,"CQ7F+325, Unnamed, Road, Gò Công Đông, Tiền Giang, Vietnam",903
Vân Canh,13.62091399974702,108.9983839,"JXCX+F7G, ĐT638, TT. Vân Canh, Vân Canh, Bình Định, Vietnam",904
Van Dien,20.94750920040336,105.8453274,"Đ. Ngọc Hồi/Ngõ 53 Xóm Bến, Tổ, Xóm Bến, Thanh Trì, Hà Nội, Vietnam",905
Vân Đình,20.73589690039858,105.7685083,"PQP9+7HJ, TT. Vân Đình, Ứng Hòa, Hà Nội, Vietnam",906
Vân Du,20.151199000378966,105.7304275,"5P2J+86G, Phố Cát, Thạch Thành, Thanh Hoá, Vietnam",907
Vạn Giã,12.699681399648034,109.2244852,"126 Lê Đại Hành, Vạn Giã, Vạn Ninh, Khánh Hòa, Vietnam",908
Văn Giang,20.9443916004033,105.9296038,"WWVH+QMM, Công Luận, Văn Giang, Hưng Yên, Vietnam",909
Văn Kê,10.706203599478467,107.9872701,"PX4P+7P6, ĐT719, Tân Thành, Hàm Thuận Nam, Bình Thuận, Vietnam",910
Văn Quan,21.865264300409457,106.5402626,"145 QL1B, TT. Văn Quan, Văn Quan, Lạng Sơn, Vietnam",911
Vân Tùng,22.431248600401275,105.9964467,"CXJW+FMF, QL3, Vân Tùng, Ngân Sơn, Bắc Kạn, Vietnam",912
Vị Dương,20.87532710040187,106.83204419999998,"VRFJ+XH5, Vị Dương, Yên Hưng, Quảng Ninh, Vietnam",913
Việt Lâm,22.62549810039639,104.95880889999998,"JXG5+673, QL2, TT. NT Việt Lâm, Vị Xuyên, Hà Giang, Vietnam",914
Việt Quang,22.41189580040169,104.80612379999998,"53 Nguyễn Văn Trỗi, TT. Việt Quang, Bắc Quang, Hà Giang, Vietnam",915
Việt Thắng,8.856484699398237,105.02063979999998,"79ap Cầu Đầm Cùng, Trần Thới, Cái Nước, Cà Mau, Vietnam",916
Vĩnh An,15.3811264999523,108.7712699,"9QJC+GF8, Vĩnh An, Bình Sơn District, Quang Ngai, Vietnam",917
Vĩnh An,11.091564599505286,107.0415577,"54 Lê Đại Hành, TT. Vĩnh An, Vĩnh Cửu, Đồng Nai, Vietnam",918
Vinh Bao,20.69003490039738,106.4812832,"MFRJ+2G6 Đài tưởng niệm anh hùng liệt sỹ huyện Vĩnh Bảo, TT. Vĩnh Bảo, Vĩnh Bảo, Hải Phòng, Vietnam",919
Vinh Binh,10.339057899455986,106.58065,"8HQJ+C8V, TT. Vĩnh Bình, Gò Công Tây District, Tien Giang, Vietnam",920
Vĩnh Bình,10.44202509946198,105.1723372,"C5RC+PXX, Vĩnh Bình Province, Châu Thành District, An Giang, Vietnam",921
Vinh Chau,9.323855899410509,105.98057199999998,"14 Nguyễn Huệ, TT. Vinh Châu, Vĩnh Châu, Sóc Trăng, Vietnam",922
Vĩnh Giang,15.690926799988643,108.474766,"MFVF+2MW, Bình Hải, Thăng Bình District, Quảng Nam, Vietnam",923
Vĩnh Hưng,10.894636099491182,105.787214,"Số 48 Đường Ba Mươi Tháng Tư, Thị trấn Vĩnh Hưng, Vĩnh Hưng, Long An, Vietnam",924
Vĩnh Linh,11.64874189954949,107.2808739,"J7XJ+F8 Cát Tiên District, Lam Dong, Vietnam",925
Vĩnh Lộc,20.05458740037484,105.6159132,"3J38+P6G, Vĩnh Thành, Vĩnh Lộc, Thanh Hoá, Vietnam",926
Vĩnh Lộc,22.143786200406566,105.271826,"47VC+HJ8, TT. Vĩnh Lộc, Chiêm Hóa, Tuyên Quang, Vietnam",927
Vinh Quang,22.742780200392925,104.680053,"PMVJ+327, ĐT178, TT. Vinh Quang, Hoàng Su Phì, Hà Giang, Vietnam",928
Vĩnh Thanh,16.436417900074044,107.7755829,"CQPG+H6 Phú Vang District, Thua Thien Hue, Vietnam",929
Vĩnh Thạnh,10.230926899449956,105.3974664,"69JW+8X9, Thị trấn Vĩnh Thạnh, Vĩnh Thạnh, Cần Thơ, Vietnam",930
Vĩnh Thạnh,14.108902399802687,108.78404,"4Q5M+JPM, ĐT637, TT. Vĩnh Thạnh, Vĩnh Thạnh, Bình Định, Vietnam",931
Vĩnh Thạnh Trung,10.61314309947248,105.21215589999998,"252 QL91, Vĩnh Thạnh Trung, Châu Phú, An Giang, Vietnam",932
Vĩnh Thịnh,21.174541600407093,105.4888595,"213, Quốc Lộ 2C, Xã Vĩnh Thịnh, Huyện Vĩnh Tường, Tỉnh Vĩnh Phúc, Vĩnh Thịnh, Vĩnh Tường, Vĩnh Phúc, Vietnam",933
Vĩnh Thuận District,9.508383499416883,105.2573468,"G755+623, QL63, TT. Vĩnh Thuận, Vĩnh Thuận, Kiên Giang, Vietnam",934
Vĩnh Trụ,20.563336000393765,106.03194999999998,"H27J+9V2, 9716, Vĩnh Trụ, Lý Nhân, Hà Nam, Vietnam",935
Vinh Tuong,21.221485100407683,105.50221059999998,"6GC2+HV Vĩnh Tường, Vĩnh Phúc, Vietnam",936
Vĩnh Tuy,22.273515700404463,104.8869298,"Cụm CN Nam Quang,Vĩnh Tuy, 7VFQ+M34, TT. Vĩnh Tuy, Bắc Quang, Hà Giang, Vietnam",937
Vĩnh Viễn,9.665666499422992,105.4651083,"MF88+84H, Vĩnh Viễn, Long Mỹ District, Hau Giang, Vietnam",938
Vĩnh Xương,10.907802299492095,105.18009809999998,"W55J+32C, Chợ, Ấp 1, An Phú, An Giang, Vietnam",939
Vị Xuyên,22.667883500395178,104.9818144,"MX9J+5PP, TT. Vị Xuyên, Vị Xuyên District, Ha Giang, Vietnam",940
Vôi,21.35470230040902,106.2602091,"79 QL37, TT. Vôi, Lạng Giang, Bắc Giang, Vietnam",941
Võ Xu,11.190048799512644,107.5809883,"60 Nguyễn Bỉnh Khiêm, Võ Xu, Đức Linh, Bình Thuận, Vietnam",942
Vụ Bản,20.464023200390617,105.4436458,"FC7V+GCQ, Vụ Bản, Hòa Bình, Lạc Sơn District, Hoa Binh, Vietnam",943
Vũng Liêm,10.09642999944284,106.1871648,"320 TL 907, Vũng Liêm, Vĩnh Long, Vietnam",944
Vùng Tu,14.85540899989019,108.94480559999998,"VW4V+5W Đức Phổ District, Quang Ngai, Vietnam",945
Vương,20.700320900397656,106.121616,"341 Quốc lộ 39B cũ, Ngô Quyền, Tiên Lữ, Hưng Yên, Vietnam",946
Vũ Quang,18.38242500026711,105.5040893,"9GJ3+VQQ, ĐT5, TT. Vũ Quang, Vũ Quang, Hà Tĩnh, Vietnam",947
Vũ Thư,20.43393610038962,106.2896648,"C7MR+92V, TT. Vũ Thư, Vũ Thư District, Thai Binh, Vietnam",948
Xã Đăng Hà,11.625589599547531,107.2874295,"J7GP+6X Bù Đăng District, Binh Phuoc, Vietnam",949
Xà Nay,15.081658799916942,108.6126949,"3JJ7+M3 Sơn Hà District, Quang Ngai, Vietnam",950
Xeo Quao,9.815750699429392,104.921086,"RW8C+8C An Minh District, Kien Giang, Vietnam",951
Xiaobazi,22.807161200390865,104.3066263,"R844+VM Xiaobazizhen, Maguan County, Wenshan Zhuang and Miao Autonomous Prefecture, Yunnan, China",952
Xóm Ngâm,18.000962840233015,106.4582526804644,"2F25+GFV, Ha Tinh, Kỳ Anh, Hà Tĩnh, Vietnam",953
Xóm Sở,9.237760199407829,105.07306859999998,"63QF+65V, Hồ Thị Kỷ, Thới Bình, Ca Mau, Vietnam",954
Xóm Tân,19.76938190036125,105.9023518,"254 Tôn Thất Tùng, Quảng Tiến, Sầm Sơn, Thanh Hoá, Vietnam",955
Xốp Cốc,19.21358530032885,104.70119839999998,"6P72+CF Tương Dương District, Nghe An, Vietnam",956
Xuân An,18.64163320028797,105.7159962,"3 Đ. Nguyễn Ngọc Huấn, TT. Xuân An, Nghi Xuân, Hà Tĩnh, Vietnam",957
Xuân Dục,13.168166499697186,109.2885888,"579Q+6CW, An Phú, Tuy Hòa, Phú Yên, Vietnam",958
Xuân Dương,21.09560310040596,106.2578919,"37W5+65 Gia Bình District, Bac Ninh Province, Vietnam",959
Xuân Hòa,22.90129180038765,106.0770582,"W32G+HQV, ĐT203, Thị trấn Xuân Hòa, Hà Quảng, Cao Bằng, Vietnam",960
Xuân Mai,17.188867900155138,106.78330680000002,"5QQM+HH5, Mai Hạ, Quảng Bình, Vietnam",961
Xuân Mai,20.89925260040238,105.5719852,"VHXC+PQG, Đ. Tân Bình, TT. Xuân Mai, Chương Mỹ, Hà Nội, Vietnam",962
Xuân Trường,20.291873200384533,106.33434549999998,"78RM+RP3, TT. Xuân Trường, Xuân Trường, Nam Định, Vietnam",963
Xuân Viên,16.70921980010417,107.364024,"P957+RF2, Điền Hương, Phong Điền District, Thua Thien Hue, Vietnam",964
Yên Bình,21.728022000410064,104.9586615,"tổ 10 thị trấn yên bình, TT. Yên Bình, Yên Bình, Yên Bái, Vietnam",965
Yên Bình,22.411177800401724,104.5731796,"19 Đ. Nguyễn Huệ, Yên Thành, Quang Bình, Hà Giang, Vietnam",966
Yên Cát,19.667789600355896,105.4404399,"Thị Trấn Như Xuân, Huyện Như Xuân, MC9R+448, TT. Yên Cát, Như Xuân, Thanh Hoá, Vietnam",967
Yên Châu,21.04641760040517,104.29749359999998,"27WX+84V, QL6, TT. Yên Châu, Yên Châu, Sơn La, Vietnam",968
Yên Định,20.195415800380783,106.29167569999998,"57WR+6RF, Đất Vượt, Khu 4, Hải Hậu, Nam Định, Vietnam",969
Yên Hòa,19.188271700327203,105.36633919999998,"59Q8+8G Tân Kỳ District, Nghe An, Vietnam",970
Yên Hòa,19.1819627003268,105.1939997,"55JV+QH Tân Kỳ District, Nghe An, Vietnam",971
Yến Lạc,22.23782280040508,106.1845435,"65QM+3RX, TT. Yên Lạc, Na Rì, Bắc Kạn, Vietnam",972
Yên Lâm,20.07253280037564,105.5297063,"3GCH+9GP, Yên Lâm, Yên Định District, Thanh Hoa, Vietnam",973
Yên Lập,21.34971870040898,105.0578732,"83X5+W73, Tân An 2, Yên Lập, Phú Thọ, Vietnam",974
Yên Minh,23.11720450037937,105.14912339999998,"449X+2G9, Trần Hưng Đạo, TT. Yên Minh, Yên Minh, Hà Giang, Vietnam",975
Yên Mỹ,20.880885900401992,106.0317122,"37 Xóm Dộc, TT. Yên Mỹ, Yên Mỹ, Hưng Yên, Vietnam",976
Yên Ninh,20.18226970038025,106.05953449999998,"Nhà số 4, Ngách 27/176 Đường Hồng Tiến, Khánh Ninh, Yên Khánh, Ninh Bình, Vietnam",977
Yên Phú,22.738445200393063,105.31100089999998,"P8Q6+54Q, Yên Phú, Bắc Mê, Hà Giang, Vietnam",978
Yên Sơn,21.87669680040938,105.13968649999998,"V4GQ+FQG, QL2, Yên Sơn, Tuyên Quang, Vietnam",979
Yên Thành,18.99855700031435,105.471158,"XFXC+GHH, khối 1 tt Yên Thành, Yên Thành, Nghệ An, Vietnam",980
Yên Thế,22.113397600406987,104.7763652,"4Q7G+67M, Tổ 7, Lục Yên, Yên Bái, Vietnam",981
Yên Thịnh,20.16231110037943,106.00702409999998,"5264+RP8, TT. Yên Thịnh, Yên Mô, Ninh Bình, Vietnam",982
Yên Viên,21.0854769004058,105.9176239,"370 Đ. Hà Huy Tập, Yên Viên, Gia Lâm, Hà Nội, Vietnam",983
Za Rong,15.65252999998416,107.81380559999998,"MR27+RPR, Cà Dy, Nam Giang District, Quảng Nam, Vietnam",984
Ái Quốc,20.963087700403666,106.38226749999998,"X97J+5P7, Ái Quốc, Thành phố Hải Dương, Hai Duong, Vietnam",985
An Binh,10.876296399489908,106.7565322,"Ấp An Bình, Xã An Bình, Huyện Dĩ An, Tỉnh Bình Dương, VQG4+GJH, An Bình, Dĩ An, Bình Dương, Vietnam",986
An Bình,10.926841799493427,106.8539258,"25/4 Số 4, An Bình, Thành phố Biên Hòa, Đồng Nai, Vietnam",987
An Bình,9.966060999436356,105.1185607,"25a Trương Định, Phường An Bình, Rạch Giá, Kiên Giang, Vietnam",988
An Cựu,16.45020370007558,107.598003,"105B Ngự Bình, An Cựu, Thành phố Huế, Thừa Thiên Huế, Vietnam",989
An Đông,16.45885940007655,107.610832,"42 Hoàng Quốc Việt, An Đông, Thành phố Huế, Thừa Thiên Huế, Vietnam",990
An Hoa,20.11821800037759,106.1129037,"4497+5CR, làng Đồng Nhân, Kim Sơn, Ninh Bình, Vietnam",991
An Hòa,16.483970600079346,107.5511948,"88+90 Lý Thái Tổ, tổ 5, An Hòa, Thành phố Huế, Thừa Thiên Huế, Vietnam",992
An Hòa,9.971724799436627,105.10208129999998,"1073c Đ. Lâm Quang Ky, P. An Hoà, Rạch Giá, Kiên Giang, Vietnam",993
An Hòa,10.88863339949076,106.864894,"VVQ7+FWV, An Hoà, Thành phố Biên Hòa, Đồng Nai, Vietnam",994
An Khánh,10.78504249948369,106.7295179,"253 Lương Định Của, An Phú, Quận 2, Thành phố Hồ Chí Minh, Vietnam",995
An Lạc,10.723415299479596,106.6157615,"PJF8+98W, 173, An Lạc, Bình Tân, Thành phố Hồ Chí Minh, Vietnam",996
An Lac A Ward,10.751050199481424,106.62205319999998,"21 Đường số 7B, An Lạc A, Bình Tân, Thành phố Hồ Chí Minh, Vietnam",997
An Lão,14.56559639985601,108.76200839999998,"HQ86+6R An Lão District, Bình Định, Vietnam",998
An Lập,11.23450249951603,106.48382759999998,"6FMM+RG Dầu Tiếng District, Binh Duong, Vietnam",999
An Loc,10.790625999484064,105.3695072,"Q9R9+7R Hồng Ngự, Đồng Tháp, Vietnam",1000
An Lộc,11.658875599550347,106.6026602,"MJ53+H4G, Đoàn Thị Điểm, An Lộc, Bình Long, Bình Phước, Vietnam",1001
An Loi Dong,10.76645929948245,106.7268571,"011 Nguyễn Cơ Thạch, An Lợi Đông, Quận 2, Thành phố Hồ Chí Minh, Vietnam",1002
An Phu,10.791461199484123,106.745545,"15 771, Tổ 44, Quận 2, Thành phố Hồ Chí Minh, Vietnam",1003
An Phú,10.948727499494977,106.7333933,"5 An Phú - An Thạnh, An Phú, Thuận An, Bình Dương, Vietnam",1004
An Phu Dong,10.854197599488389,106.69107479999998,"5D 1648, Tổ 23, Quận 12, Thành phố Hồ Chí Minh, Vietnam",1005
An Sơn,10.934583099493976,106.664444,"WMM7+WH6, Đ. An Sơn 02, An Sơn, Thuận An, Bình Dương, Vietnam",1006
An Tây,16.433615700073734,107.5996733,"CHMX+6MF, An Tây, Thành phố Huế, Thua Thien Hue, Vietnam",1007
An Thái,13.908857299779662,109.0184741,"W259+972, Nhơn Phúc, An Nhơn, Bình Định, Vietnam",1008
An Thái Trung,10.317188999454745,105.8955514,"8V8W+V6 Cái Bè District, Tien Giang, Vietnam",1009
An Thanh,10.812857399485567,105.3453252,"11 Hùng Vương, Phường An Thạnh, Hồng Ngự, Đồng Tháp, Vietnam",1010
An Thạnh,10.95234419949523,106.6865859,"XM2P+GJM, An Thạnh, Thuận An, Bình Dương, Vietnam",1011
An Thoi,10.019698699438973,104.01434089999998,"2297+RPQ, Khu 2, Phú Quốc, Kien Giang, Vietnam",1012
An Thủy,9.985824299437311,106.6282517,"XJPG+9WF, An Thủy, Ba Tri District, Ben Tre, Vietnam",1013
Bac Cuong,22.469777800400383,103.9812148,"FXCJ+4GG, Tổ 4, Lào Cai, Vietnam",1014
Bạch Đằng,20.95252020040345,107.0901659,"Tượng đài VŨ VĂN HIẾU, Đường Lê Thánh Tông, P. Bạch Đằng, Thành phố Hạ Long, Quảng Ninh, Vietnam",1015
Bắc Lệnh,22.433452500401224,104.0099823,"042a Đ. Hoàng Quốc Việt, P. Bắc Lệnh, Lào Cai, Vietnam",1016
Bắc Từ Liêm,21.06986050040556,105.7573392,"3Q94+WW Bac Tu Liem, Hanoi, Vietnam",1017
Ba Đình,21.03407460040496,105.8145271,"25 P. Liễu Giai, Liễu Giai, Ba Đình, Hà Nội, Vietnam",1018
Bãi Cháy,20.95907200040358,107.0512487,"40 Anh Đào, Bãi Cháy, Thành phố Hạ Long, Quảng Ninh, Vietnam",1019
Ba Ngòi,11.914175599572632,109.12724009999998,"W47G+MV Cam Ranh, Khánh Hòa, Vietnam",1020
Bẩn Yên Nhân,20.937577400403168,106.05512029999998,"W3Q4+32J, Văn Nhuế, Mỹ Hào, Hưng Yên, Vietnam",1021
Bào Toàn,22.97254870038505,105.6126042,"XJF7+22 Bảo Lạc District, Cao Bang, Vietnam",1022
Bàu Đồn,11.178310599511756,106.3076971,"58H5+775, Bàu Đồn, Gò Dầu District, Tây Ninh, Vietnam",1023
Bàu Hàm 2,10.958677399495675,107.1421051,"X45R+G7V, QL20, Xuân Thạnh, Thống Nhất, Đồng Nai, Vietnam",1024
Bàu Năng,11.31643969952238,106.15917199999998,"1100 Đ. tỉnh 781, Bàu Năng, Dương Minh Châu, Tây Ninh, Vietnam",1025
Bến Đầm,8.656420599394709,106.5733909,"MH4C+QRX, Bến Đầm, Côn Đảo, Bà Rịa - Vũng Tàu, Vietnam",1026
Ben Nghe Ward,10.781234299483437,106.7026503,"Khoa Dược, Đ. Nguyễn Du, Bến Nghé, Quận 1, Thành phố Hồ Chí Minh, Vietnam",1027
Ben Thanh Ward,10.77286649948288,106.69429999999998,"115/22/20 Đ. Nguyễn Du, Phường Bến Thành, Quận 1, Thành phố Hồ Chí Minh, Vietnam",1028
Bến Thủy,18.65809860028924,105.7044863,"43 Nguyễn Đức Đạt, Bến Thủy, Thành phố Vinh, Nghệ An, Vietnam",1029
Bình An,10.905478199491936,106.80120999999998,"WR42+5H7, Khu Phố Bình Thung 1, Thuận An, Bình Dương, Vietnam",1030
Binh Chieu,10.879888899490153,106.7296814,"30/1 Tô Ngọc Vân, Bình Chiểu, Thủ Đức, Thành phố Hồ Chí Minh, Vietnam",1031
Binh Chuan Ward,10.9843140994975,106.7227363,"XPMF+Q34, Bình Chuẩn, Thuận An, Bình Dương, Vietnam",1032
Bình Đa,10.936256999494091,106.86241599999998,"383, Khu Phố 2, Phường Bình Đa, Bình Đa, Thành phố Biên Hòa, Đồng Nai, Vietnam",1033
Bình Hoà,10.91612009949268,106.7233932,"WP8F+M55, Bình Hòa, Thuận An, Binh Duong, Vietnam",1034
Bình Hòa Đông,10.733846599480284,106.0386495,"P2MQ+GF Mộc Hóa District, Long An, Vietnam",1035
Bình Hưng Hòa B,10.81397619948564,106.5942042,"224 Đường số 3, Bình Hưng Hoà B, Bình Tân, Thành phố Hồ Chí Minh, Vietnam",1036
Bình Minh,11.349492399524982,106.0945415,"UBND xã Bình Minh, 504 Đ. Trần Văn Trà, Bình Minh, Tây Ninh, Vietnam",1037
Bình Minh,10.951928099495198,106.978953,"16 Đường số 56, Bình Minh, Trảng Bom, Đồng Nai, Vietnam",1038
Bình Minh,22.4299739004013,104.0294652,"C2JH+7WV, Bình Minh, Lào Cai, Lao Cai, Vietnam",1039
Bình Ngọc,21.46456910040974,107.99273259999998,"FX7V+R3 Móng Cái, Quảng Ninh, Vietnam",1040
Bình Nhâm,10.923621099493204,106.69410999999998,"WMFV+FM6, Cây Me, Binh Nhâm, Thuận An, Bình Dương, Vietnam",1041
Bình Sơn,11.838138099565873,106.9324763,"RWQM+C3F, Bình Sơn, Bù Gia Mập District, Binh Phuoc, Vietnam",1042
Binh Tan,10.669247199476064,107.7735959,"15 Lê Lai, Phường Bình Tân, Hàm Tân, Bình Thuận, Vietnam",1043
Bình Tân,11.796974899562256,106.9340225,"QWWM+WFQ, Thôn phước hoà, Bù Gia Mập, Bình Phước, Vietnam",1044
Binh Thang,10.894015999491137,106.8171559,"Số 155A, Xa Lộ Hà Nội, Khu phố Hiệp Thắng, Phường Bình Thắng, Thị Xã Dĩ An, Bình Dương, Bình An, Dĩ An, Bình Dương, Vietnam",1045
Binh Thanh,11.016695399499824,106.2098744,"2685+MW Trảng Bàng, Tây Ninh, Vietnam",1046
Bình Thanh,11.18922089951258,108.6955105,"5MQW+M6 Tuy Phong District, Bình Thuận, Vietnam",1047
Bình Thọ,10.845423999487783,106.7664221,"Số 24 Khổng Tử, Bình Thọ, Thủ Đức, Thành phố Hồ Chí Minh, Vietnam",1048
Bình Thủy,10.528823599467223,105.318464,"Ấp Bình Yên, Xã Bình Thủy, Huyện Châu Phú, Tỉnh An Giang, G8H9+9F7, Bình Thuỷ, Châu Phú, An Giang, Vietnam",1049
Bình Trị Đông,10.76390139948228,106.6182036,"381 Tân Hòa Đông, Bình Trị Đông, Bình Tân, Thành phố Hồ Chí Minh 700000, Vietnam",1050
Bình Trị Đông A,10.768953799482617,106.6021101,"215 Mã Lò, Khu phố 8, Bình Tân, Thành phố Hồ Chí Minh, Vietnam",1051
Bình Trị Đông B,10.748753599481272,106.611218,"235 Tên Lửa, Bình Trị Đông B, Bình Tân, Thành phố Hồ Chí Minh, Vietnam",1052
Binh Trung Dong,10.788744499483942,106.77198339999998,"51/10 Nguyễn Văn Giáp, Bình Trưng Đông, Quận 2, Thành phố Hồ Chí Minh, Vietnam",1053
Binh Trung Tay,10.786351299483778,106.764021,"18C Nguyễn Tuyển, Phường Bình Trưng Tây, Quận 2, Thành phố Hồ Chí Minh, Vietnam",1054
Binh Xa,21.66666700041017,107.15,"M48X+MX Đình Lập District, Lạng Sơn, Vietnam",1055
Bồ Đề,21.038033900405026,105.8738172,"6/4/109 P. Bồ Đề, Tổ 11, Long Biên, Hà Nội, Vietnam",1056
Bửu Hòa,10.924599399493273,106.8148612,"WRF8+Q7J, Bửu Hoà, Thành phố Biên Hòa, Dong Nai, Vietnam",1057
Bửu Long,10.958812899495689,106.79884029999998,"A6 duong 1 K2, Bửu Long, Thành phố Biên Hòa, Đồng Nai, Vietnam",1058
Cái Vồn,10.06646139944131,105.8099572,"3R85+3VR, Cái Vồn, Bình Minh, Vinh Long, Vietnam",1059
Cẩm An,15.911894700014324,108.3395035,"W86Q+RVJ, Cẩm An, Hội An, Quảng Nam, Vietnam",1060
Cẩm Châu,15.8866030000114,108.3441972,"69 Trần Nhân Tông, Cẩm Châu, Hội An, Quảng Nam, Vietnam",1061
Cam Đường,22.40528000040185,104.0240916,"C24F+5QC, Unnamed, Road, Lào Cai, Vietnam",1062
Cẩm Hà,15.900414000013004,108.3136382,"W827+3CC, Cẩm Hà, Hội An, Quảng Nam, Vietnam",1063
Cẩm Kim,15.864436900008831,108.3176541,"V889+25V, Cẩm Kim, Hội An, Quảng Nam, Vietnam",1064
Cam Le,16.016092500026343,108.18957319999998,"1050 Tôn Đản, Hoà Thọ Tây, Cẩm Lệ, Đà Nẵng, Vietnam",1065
Cam Linh,11.907291799572016,109.14839469999998,"79/2, Cam Linh, Cam Ranh, Khánh Hòa, Vietnam",1066
Cam Lộc,11.92185839957332,109.14076,"134 Hoàng Văn Thụ, Cam Lộc, Cam Ranh, Khánh Hòa, Vietnam",1067
Cam Lợi,11.913458299572566,109.1423822,"W47V+633, Cam Lợi, Cam Ranh, Khánh Hòa, Vietnam",1068
Cẩm Nam,15.873061400009831,108.3347057,"97 Nguyễn Tri Phương, Cẩm Nam, Hội An, Quảng Nam, Vietnam",1069
Cẩm Phô,15.881284500010786,108.32193209999998,"24 Lê Quý Đôn, Phường Cẩm Phổ, Hội An, Quảng Nam, Vietnam",1070
Cam Phu,11.927356899573812,109.15908059999998,"W5G5+JXH, Cam Phú, Cam Ranh, Khánh Hòa, Vietnam",1071
Cẩm Phú,21.01273810040458,107.3338079,"125 Võ Thị Sáu, Cẩm Phú, Cẩm Phả, Quảng Ninh, Vietnam",1072
Cam Phúc Nam,11.942854399575207,109.16866249999998,"W5V9+4F Cam Ranh, Khánh Hòa, Vietnam",1073
Cẩm Sơn,21.002811600404407,107.3119211,"169 Đ. Hoàng Quốc Việt, Cẩm Sơn, Cẩm Phả, Quảng Ninh 203781, Vietnam",1074
Cẩm Thạch,21.008590800404512,107.2537601,"60 Ngõ 1063 - Trần Phú, Cẩm Thạch, Cẩm Phả, Quảng Ninh, Vietnam",1075
Cẩm Thanh,15.876253500010202,108.3660605,"V9G8+Q8C, ĐX18, Cẩm Thanh, Hội An, Quảng Nam, Vietnam",1076
Cẩm Thành,21.01146520040456,107.2791606,"297 Trần Phú, Cẩm Thành, Cẩm Phả, Quảng Ninh, Vietnam",1077
Cẩm Thịnh,21.005910900404466,107.3430063,"284V+96 Cẩm Phả, Quảng Ninh, Vietnam",1078
Cam Thuận,11.914344299572647,109.1533299,"W573+V58, Cam Thuận, Cam Ranh, Khánh Hòa, Vietnam",1079
Cẩm Thủy,21.010223300404544,107.2627026,"797 Trần Phú, Cẩm Thu, Cẩm Phả, Quảng Ninh, Vietnam",1080
Cẩm Trung,21.00712850040448,107.2687429,"20b, ngõ 110 Tô Hiệu, Cẩm Trung, Cẩm Phả, Quảng Ninh, Vietnam",1081
Cao Thắng,20.96365380040368,107.0955956,"211 Dốc Tạp Phẩm, Cao Thắng, Thành phố Hạ Long, Quảng Ninh, Vietnam",1082
Cao Xanh,20.980380100403988,107.0827742,"X3JJ+4X5, Trần Thái Tông, Cao Xanh, Thành phố Hạ Long, Quảng Ninh, Vietnam",1083
Cat Lai,10.769163299482628,106.7860907,"QQ9P+HG9, Đường 35 CL, Cát Lái, Thủ Đức, Thành phố Hồ Chí Minh, Vietnam",1084
Cầu Giấy,21.02727690040484,105.79146409999998,"Đối Diện Trường Mầm Non Vietkids - KĐT Dịch Vọng, Dịch Vọng, Cầu Giấy, Hà Nội, Vietnam",1085
Cau Kho,10.758051599481888,106.6889834,"TK30/8 Đ. Nguyễn Cảnh Chân, Cầu Kho, Quận 1, Thành phố Hồ Chí Minh, Vietnam",1086
Cầu Ông Lãnh,10.765771599482402,106.6964662,"45/2 Nguyễn Thái Học, Phường Cầu Ông Lãnh, Quận 1, Thành phố Hồ Chí Minh, Vietnam",1087
Chà Là,11.30352049952137,106.189363,"853Q+CP Dương Minh Châu District, Tây Ninh, Vietnam",1088
Chanh My,10.991701699498028,106.6320877,"16/17, Ấp Chánh Lộc B, Xã Chánh Mỹ, Chánh Mỹ, Thủ Dầu Một, Bình Dương, Vietnam",1089
Chánh Nghĩa,10.96592419949619,106.6598224,"164/20A, đường Bùi Quốc Khánh, Chánh Nghĩa, Thủ Dầu Một, Bình Dương, Vietnam",1090
Chat Binh,20.13197280037817,106.13199579999998,"44MJ+2VG, Chất Bình, Kim Sơn District, Ninh Bình, Vietnam",1091
Chí Công,11.184233299512206,108.6171168,"5JM8+PJ2, Unnamed, Road, Tuy Phong, Bình Thuận, Vietnam",1092
Chi Lăng,21.83878930040961,106.7504951,"47A Tổ Sơn, Khối Văn Miếu, Thành phố Lạng Sơn, Lạng Sơn, Vietnam",1093
Chí Minh,21.08998580040588,106.3723755,"39QC+FV3, Chi Minh, Chí Linh District, Hai Duong, Vietnam",1094
Chinh Tam,20.140929400378543,106.13760840000002,"44RQ+92 Kim Sơn District, Ninh Bình, Vietnam",1095
Chờ,21.19425330040735,105.95228609999998,"96 ĐT286, TT. Chờ, Yên Phong, Bắc Ninh, Vietnam",1096
Chua Hang,21.62565660041017,105.8414228,"34 đường Núi Voi, Chùa Hang, Đồng Hỷ, Thái Nguyên, Vietnam",1097
Cổ Bi,21.02799410040485,105.9405887,"81 Cổ Bi, Gia Lâm, Hà Nội, Vietnam",1098
Cốc Lếu,22.49559440039977,103.9671351,"FXW8+5RC, Phan Chu Trinh, Cốc Lếu, Lào Cai, Vietnam",1099
Co Giang Ward,10.762009899482152,106.6933648,"168 Cô Giang, Phường Cô Giang, Quận 1, Thành phố Hồ Chí Minh, Vietnam",1100
Cộng Hòa,21.126858700406427,106.39829629999998,"49GX+P8 Chí Linh District, Hai Duong, Vietnam",1101
Côn Sơn,8.685508099395156,106.6067254,"MJP4+7MC, Côn Đảo, Bà Rịa - Vũng Tàu, Vietnam",1102
Con Thoi,19.99397380037213,106.0793366,"X3VH+PPJ, Cồn Thoi, Kim Sơn District, Ninh Bình, Vietnam",1103
Cỏ Ống,8.72745699939584,106.6275984,"PJHG+5R7, Đường Cỏ Ống, Côn Đảo, Bà Rịa - Vũng Tàu, Vietnam",1104
Cổ Thành,21.08868450040585,106.3143539,"38Q7+FP Chí Linh District, Hai Duong, Vietnam",1105
Cửa Đại,15.893583900012212,108.3724093,"V9VC+PX5, Cửa Đại, Hội An, Quảng Nam, Vietnam",1106
Cửa Ông,21.0309140004049,107.3657249,"21 Nguyễn Quyên, Cửa Ông, Cẩm Phả, Quảng Ninh, Vietnam",1107
Cự Khối,21.00974540040453,105.9012807,"2W52+VG Long Biên, Hanoi, Vietnam",1108
Đại Đồng,21.092007800405906,105.9888625,"3XRQ+RG Tiên Du District, Bac Ninh Province, Vietnam",1109
Đại Nài,18.322099300262053,105.9121075,"8WC6+VVF, Đại Nài, Hà Tĩnh, Ha Tinh, Vietnam",1110
Đại Tâm,9.549975699418436,105.9196585,"GWX9+XV Mỹ Xuyên District, Soc Trang, Vietnam",1111
Đại Yên,20.97282060040385,106.9282043,"XWFH+97G, Quỳnh Trung, Đại Yên, Thành phố Hạ Long, Quảng Ninh, Vietnam",1112
Đa kia,11.883459999569888,106.8742598,"VVMF+FW7, Đa Kia, Bù Gia Mập District, Binh Phuoc, Vietnam",1113
Đăk Nia,11.957085999576492,107.72785659999998,"XP5H+6HC, QL28, Đắk Nia, Gia Nghĩa, Đắk Nông, Vietnam",1114
Đắk R'Moan,12.019617699582174,107.62837369999998,"Thôn Tân Lợi - Xã, 2J9G+QXP, Đăk R'Moan, Gia Nghĩa, Đắk Nông, Vietnam",1115
Dak Ru,11.895437299570954,107.419169,"VCWC+349, Đắk Ru, Đăk R'Lấp District, Dak Nong, Vietnam",1116
Dak Sin,11.905317499571838,107.49579239999998,"WF4W+48 Đăk R'Lấp District, Dak Nong, Vietnam",1117
Dak Wer,12.020263199582232,107.5539889,"2HC3+4H Đăk R'Lấp District, Dak Nong, Vietnam",1118
Dao Nghia,11.857183799567553,107.5787,"VH4H+VF Đăk R'Lấp District, Dak Nong, Vietnam",1119
Di An,10.898400399491443,106.7626905,"86c Ngô Thì Nhậm, Dĩ An, Bình Dương, Vietnam",1120
Dien Duong,15.920422100015314,108.2972568,"W7CW+8RV, Điện Dương, Điện Bàn, Quảng Nam, Vietnam",1121
Điện Phong,15.852972200007503,108.2425546,"V62R+QXG, Điện Phong, Điện Bàn, Quảng Nam, Vietnam",1122
