Name,Latitude,Longitude,Address,id
Lộc Hà,18.45711590027326,105.90569109999998,"FW44+J9G, ĐT9, Thạch Bằng, Lộc Hà, Hà Tĩnh, Vietnam",455
Lộc Ninh,11.845164499566492,106.590373,"RHWR+237, Khu Phố Ninh Thái, Lộc Ninh, Bình Phước, Vietnam",456
Lộc Thắng,11.626962099547647,107.8396759,"20 Trần Phú, TT. Lộc Thắng, Bảo Lâm, Lâm Đồng 670000, Vietnam",457
Lợi Hải,11.7156565995552,109.05984309999998,"P385+7WP, QL1A, Lợi Hải, Thuận Bắc, Ninh Thuận, Vietnam",458
Longbang,22.888036700388124,106.32521149999998,"V8QG+63 Longbang, Jingxi, Baise, Guangxi, China",459
Long Binh,10.953426099495308,105.0833894,"335 ĐT956, Thị Trấn Long Bình, An Phú, An Giang, Vietnam",460
Long Dien,10.484248499464508,107.2133632,"244 Võ Thị Sáu, TT. Long Điền, Long Điền, Bà Rịa - Vũng Tàu 790000, Vietnam",461
Long Giao,10.811051899485443,107.2274175,"QL56, TT. Long Giao, H. Cẩm Mỹ, T, Long Giao, Cẩm Mỹ, Đồng Nai, Vietnam",462
Long Hai,10.402154299459632,107.23362939999998,"55, Tổ 7, Ô1, Khu Phố Hải Bình, TT. Long Hải, Long Điền, Bà Rịa - Vũng Tàu, Vietnam",463
Long Hiệp,14.934349899899525,108.7037703,"WPM3+RF4, ĐH3, Long Hiệp, Minh Long, Quảng Ngãi, Vietnam",464
Long Hồ,10.192960099447903,106.01121229999998,"52V6+5G4, QL53, Long Hồ, Vĩnh Long, Vietnam",465
Long Mỹ,9.67929719942355,105.5714387,"135 Cầu Trà Ban, TT. Long Mỹ, Long Mỹ, Hậu Giang, Vietnam",466
Long Phú,9.604644599420544,106.12248019999998,"J43C+VX Long Phú District, Soc Trang, Vietnam",467
Long Thanh,14.709658599872984,109.0721467,"P36F+226, Sa Huỳnh, Đức Phổ, Quảng Ngãi, Vietnam",468
Long Thành,9.60784589942067,106.4412016,"439 QL53, Long Khánh, Duyên Hải, Trà Vinh, Vietnam",469
Long Thành,10.793733899484277,106.9491715,"QWVX+HPM, Tôn Đức Thắng, TT. Long Thành, Long Thành, Đồng Nai, Vietnam",470
Lũng Tòng,22.378760700402417,106.5171717,"9GH8+GV Tràng Định District, Lạng Sơn, Vietnam",471
Lương Bằng,20.744292700398795,106.0577394,"P3V4+MX5, Lương Bằng, Kim Động, Hưng Yên, Vietnam",472
Luong Son,20.87146500040179,105.5154314,"VGC8+59P, QL6, TT. Lương Sơn, Lương Sơn, Hòa Bình, Vietnam",473
Lương Sơn,11.190192899512653,108.3666496,"59R8+8G, Lương Trung, Bắc Bình District, Bình Thuận, Vietnam",474
Lương Sơn,21.614664400410163,105.7863234,"JQ7P+VG Thành phố Thái Nguyên, Thái Nguyên, Vietnam",475
Ma'andi,22.769491900392083,103.5184911,"QG99+H2R, Jinping Miao, Yao, and Dai Autonomous County, Honghe Hani and Yi Autonomous Prefecture, Yunnan, China, 661509",476
Măch Đen,13.790793999766208,107.6204898,"QJRC+85 Đức Cơ District, Gia Lai, Vietnam",477
Ma Đa Guôi,11.384874699527789,107.53049289999998,"18 Nguyễn Du, Mạ Đa Guôi, Đạ Huoai, Lâm Đồng 66000, Vietnam",478
Mai Chau,20.667989800396786,105.08176009999998,"M39J+5P Mai Châu District, Hoa Binh, Vietnam",479
Mái Dầm,9.947090999435448,105.87312799999998,"WVWF+X9R, Unnamed, Road, Châu Thành, Hậu Giang, Vietnam",480
Mai Sao,21.688924600410143,106.6156518,"MJQ8+J6Q, Mai Sao, Chi Lăng District, Lạng Sơn, Vietnam",481
Ma Lâm,11.071942499503844,108.128718,"250 QL28, Ma Lâm, Hàm Thuận Bắc, Bình Thuận, Vietnam",482
Mãn Đức,20.616603800395342,105.2710528,"J799+2VV, QL6, TT. Mường Khến, Tân Lạc, Hòa Bình, Vietnam",483
Măng Đen,14.601460599860228,108.29162250000002,"J72R+HM9, Măng Đen, Kon Plông District, Kon Tum, Vietnam",484
Mạo Khê,21.05885430040538,106.5853044,"3H5P+J4F, TT. Mạo Khê, Đông Triều District, Quảng Ninh, Vietnam",485
Mậu A,21.881753900409343,104.688475,"VMJQ+J99, Đ. Lý Thường Kiệt, TT. Mậu A, Văn Yên, Yên Bái, Vietnam",486
M'Đrắk,12.753196299653506,108.736121,"14 Tôn Thất Tùng, Thị trấn, M'Đrắk, Đắk Lắk, Vietnam",487
Me,20.346382700386545,105.8356322,"8RWP+C8P, TT. Me, Gia Viễn, Ninh Bình, Vietnam",488
Me Lềch,21.13018620040648,104.1617203,"45J6+4GP, Cò Nòi, Mai Sơn District, Son La, Vietnam",489
Mengdong,22.87870000038844,104.71599999999998,"VPH8+FC Mengdongxiang, Malipo County, Wenshan Zhuang and Miao Autonomous Prefecture, Yunnan, China",490
Mèo Vạc,23.16595390037733,105.4102745,"22 Hạnh Phúc, TT. Mèo Vạc, Mèo Vạc, Hà Giang, Vietnam",491
Minh Đức,20.96130530040363,106.73883589999998,"XP6Q+GJM, TT. Minh Đức, Thủy Nguyên, Hải Phòng, Vietnam",492
Minh Lương,9.903101999433373,105.1596629,"778 QL61, TT. Minh Lương, Châu Thành, Kiên Giang, Vietnam",493
Minh Tân,18.05818760023914,106.2097152,"3655+7V Kỳ Anh District, Ha Tinh, Vietnam",494
Minh Tân,21.040485200405065,106.58840829999998,"2HRQ+M8X, 188, Minh Tân, Kinh Môn, Hải Dương, Vietnam",495
Minh Tiến,17.147494300150857,106.8502569,"4VW2+X4 Lệ Thủy District, Quang Binh Province, Vietnam",496
Mo Cay,10.130232499444588,106.33586789999998,"48JP+26X, Định Thủy, Mỏ Cày Nam District, Ben Tre, Vietnam",497
Mộc Châu,20.84537740040121,104.6419613,"27 Phan Đình Giót, TT. Mộc Châu, Mộc Châu, Sơn La, Vietnam",498
Mộc Châu Government Farm,20.83683670040101,104.6806005,"RMPJ+Q7Q, Lê Thanh Nghị, Phiêng Luông, Mộc Châu, Sơn La, Vietnam",499
Mộ Đức,14.95293099990172,108.87864829999998,"XV3H+5F Mộ Đức District, Quang Ngai, Vietnam",500
Mông Dương,21.056164000405325,107.32324219999998,"384F+F7 Cẩm Phả, Quảng Ninh, Vietnam",501
Mỏ Nhài,21.83868310040962,106.3521879,"R9Q2+FRR, Hưng Vũ, Bắc Sơn District, Lạng Sơn, Vietnam",502
Một Ngàn,9.9249723994344,105.6312836,"WJGJ+2HC, Một Ngàn, Châu Thành A, Hau Giang, Vietnam",503
M' Trong (2),12.66033649964403,108.62283549999998,"MJ6C+CQP, Xã Cư Bông, Ea Kar District, Dak Lak, Vietnam",504
Muang Et,20.820392400400635,104.0057814,"R2C4+7J, Muang Et, Laos",505
Mù Cang Chải,21.85161230040953,104.0896197,"V32Q+JW7, TT. Mà Căng Chải, Mù Cang Chải, Yên Bái, Vietnam",506
Mũi Né,10.94287629949456,108.2830253,"W7VM+56 Thành phố Phan Thiết, Bình Thuận, Vietnam",507
Mường Ảng,21.51948190040997,103.2223919,"G69C+QX3, QL279, TT. Mường ẳng, Mường Ảng, Điện Biên, Vietnam",508
Mường Chà,21.75866180040998,103.0904718,"Q35R+F8X, Tổ dân phố số 3, Mường Chà, Điện Biên, Vietnam",509
Mường Khương,22.75949350039241,104.1162892,"163 Đường Giải Phóng 11-11, Mường Khương, Lào Cai, Vietnam",510
Mường Lát,20.527589600392663,104.60200199999998,"GJH2+5MG, Mường Lát, Mường Lát District, Thanh Hoa, Vietnam",511
Mường Nhé,22.19191760040584,102.45844309999998,"Chợ, 5FR5+QH4, Mường Nhé, Điện Biên, Vietnam",512
Mường Tè,22.382900000402326,102.81399999999998,"9RM7+5H Mường Tè, Lai Châu, Vietnam",513
Mường Xén,19.398966300340504,104.1517448,"95X2+FP9, TT. Mường Xén, Kỳ Sơn, Nghệ An, Vietnam",514
Mỹ Á,16.35909120006537,107.89204449999998,"9V5R+JR Phú Lộc, Thua Thien Hue, Vietnam",515
Mỹ An,10.523952999466925,105.84314399999998,"GRFV+H6J, TT. Mỹ An, Tháp Mười District, Dong Thap, Vietnam",516
Mỹ Hào,20.93489570040311,106.05488309999998,"W3M4+V3J, Phố Nối, Mỹ Hào, Hưng Yên, Vietnam",517
Mỹ Hòa,19.129623800323326,105.7034162,"4PJ3+77, Mỹ Hòa, Quỳnh Lưu District, Nghe An, Vietnam",518
Mỹ Hùng,15.001550999907463,108.82379299999998,"2R2F+Q28, Hành Phước, Nghĩa Hành District, Quang Ngai, Vietnam",519
Mỹ Lộc,20.44154430038987,106.1018592,"21 QL21A, TT. Mỹ Lộc, Mỹ Lộc, Nam Định, Vietnam",520
Mỹ Long,9.808473699429069,106.5095395,"166 ĐH19, TT. Mỹ Long, Cầu Ngang, Trà Vinh, Vietnam",521
Mỹ Long,10.364581899457448,106.19111999999998,"957R+RC Cai Lậy District, Tien Giang, Vietnam",522
Mỹ Luông,10.506933199465886,105.4899951,"218 Đường Tỉnh 942 (cũ), Mỹ Luông, Chợ Mới, An Giang, Vietnam",523
My Phuoc,10.481318799464333,106.1902148,"F5JQ+9H, TT. Mỹ Phước, Tân Phước District, Tien Giang, Vietnam",524
Mỹ Thọ,10.443682499462076,105.69794419999998,"CMVX+F34, Mỹ Thọ, Cao Lanh, Dong Thap, Vietnam",525
Mỹ Thủy,16.78439950011234,107.324532,"Q8MF+CW7, Hải An, Hải Lăng District, Quảng Trị, Vietnam",526
Mỹ Xuyên,9.560295499418832,105.989376,"32 Trưng Vương, TT. Mỹ Xuyên, Mỹ Xuyên, Sóc Trăng, Vietnam",527
Na Ca,19.269291800332443,104.7924845,"7Q9R+PX Tương Dương District, Nghe An, Vietnam",528
Na Dương,21.703063200410124,106.9555726,"PX24+X7R, QL4B, TT. Na Dương, Lộc Bình, Lạng Sơn, Vietnam",529
Na Hang,22.351257800402976,105.38417189999998,"992M+5XQ, DL 279, TT. Nà Hang, Na Hang, Tuyên Quang, Vietnam",530
Nà Mặn,22.58347870039753,105.5845542,"HHMM+9R Pác Nặm District, Bắc Kạn Province, Vietnam",531
Nam Ban,11.839742199566013,108.3390933,"R8QQ+VVV, Nam Ban, Lâm Hà District, Lam Dong, Vietnam",532
Năm Căn,8.760116599396408,104.9935754,"9 Đường An Dương Vương, TT. Năm Căn, Năm Căn, Cà Mau, Vietnam",533
Nam Đàn,18.70482060029284,105.49381689999998,"PF3V+WGM, Nam Đàn, Nam Đàn District, Nghe An, Vietnam",534
Nam Giang,20.33621700038618,106.1780555,"109, Km 09, Đường 55, Giáp Tư, Nam Trực, Nam Định, Vietnam",535
Nậm Nhùn,22.14503300040655,102.9998145,"4XWX+2W Nậm Hàng, Thị xã Mường Lay, Lai Châu, Vietnam",536
Nam Phước,15.829055600004724,108.2559049,"R7H4+J9J, Nguyễn Du, TT. Nam Phước, Duy Xuyên, Quảng Nam, Vietnam",537
Nam Sách,20.990440900404177,106.3273516,"X8RG+4XW, Phố Hóp, Xã, Nam Hồng, Nam Sách, Hải Dương, Vietnam",538
Nậm Tăm,22.280370100404344,103.39859959999998,"79JX+4CF, Nậm Tăm, Sìn Hồ District, Lai Chau, Vietnam",539
Nam Yên,16.13767980004028,108.0445197,"42QV+3R Hòa Vang, Da Nang, Vietnam",540
Nàng Mau,9.754489799426713,105.5350526,"QG3M+WMV, Nàng Mau, Vị Thủy District, Hau Giang, Vietnam",541
Nà Phặc,22.38031460040237,105.8972208,"9VJW+3V2, QL3, TT. Nà Phặc, Ngân Sơn, Bắc Kạn, Vietnam",542
Nà Phùng,22.31711670040365,106.6261424,"8J8G+RF Tràng Định District, Lạng Sơn, Vietnam",543
Na Sầm,22.0567572004077,106.6156378,"2 Đường khu Ga, Khu 4, Văn Lãng, Lạng Sơn, Vietnam",544
Nà Ư,21.19458530040736,102.9582292,"5XW5+3QG, Na Ư, Điện Biên District, Dien Bien, Vietnam",545
Nếnh,21.244152200407942,106.1024398,"64V2+MX Việt Yên District, Bac Giang, Vietnam",546
Ngai Giao,10.646885499474626,107.2437519,"251 Lê Hồng Phong, TT. Ngãi Giao, Châu Đức, Bà Rịa - Vũng Tàu, Vietnam",547
Ngà Mân,14.726960599875024,109.0202249,"P2GC+Q3 Đức Phổ District, Quang Ngai, Vietnam",548
Ngã Năm,9.565551699419032,105.5974513,"3 Lạc Long Quân, Phường 1, tx. Ngã Năm, Sóc Trăng, Vietnam",549
Ngan Dừa,9.566436299419063,105.4480942,"HC8X+M85, Ngan Dừa, Hồng Dân District, Bac Lieu, Vietnam",550
Ngã Sáu,9.923257499434316,105.8071115,"WRF4+6VV, Ngô Hữu Hạnh, TT. Ngã Sáu, Châu Thành, Hậu Giang, Vietnam",551
Nga Sơn,20.00630500037269,105.9701247,"172 Đường Mai An Tiêm, TT. Nga Sơn, Nga Sơn, Thanh Hoá, Vietnam",552
Ngát Trên,15.918355900015074,107.8114596,"WR96+8H Đông Giang, Quảng Nam, Vietnam",553
Nghèn,18.458359300273354,105.7714214,"Khối 9 Bắc Cầu Nghèn, Huyện Can Lộc, Thị Trấn Nghèn, Tỉnh Hà Tĩnh, TT. Nghèn, Can Lộc, Hà Tĩnh, Vietnam",554
Nghĩa Bình,19.34472500033718,105.4930085,"8FVV+V9C, Nghĩa Bình, Nghĩa Đàn District, Nghe An, Vietnam",555
Nghĩa Bình,11.667156499551051,107.0621508,"M387+Q26, QL14, Nghĩa Trung, Bù Đăng, Bình Phước 67000, Vietnam",556
Nghĩa Lộ,21.60642010041016,104.5036951,"26 Pú Trạng, Nghĩa Lộ, Yên Bái, Vietnam",557
Nghĩa Tỏm,19.16716210032581,105.47901210000002,"5F8H+VJ Quỳnh Lưu District, Nghe An, Vietnam",558
Nghi Sơn,19.450783400343607,105.7801293,"16 Nguyễn Văn Trỗi, TT. Tĩnh Gia, Tĩnh Gia, Thanh Hoá, Vietnam",559
Ngọc Được,9.361213999411726,105.84946689999998,"9R6X+FQ Vĩnh Lợi, Bac Lieu, Vietnam",560
Ngọc Kinh,15.847460500006866,107.9387571,"RWWQ+WG7, Đại Lãnh, Đại Lộc, Quảng Nam, Vietnam",561
Ngọc Lặc,20.080978400376,105.3784177,"797 Đường Lê Thánh Tông, Phố Cống, Ngọc Lặc, Thanh Hoá 440000, Vietnam",562
Ngọc Tố,9.42948219941405,105.9670186,"CXJ9+229, Ngọc Tố, Mỹ Xuyên District, Soc Trang, Vietnam",563
Ngô Đồng,20.281907400384164,106.4443788,"7CJV+RW2, Đ. Yết Kiêu, TT. Ngô Đồng, Giao Thuỷ, Nam Định, Vietnam",564
Ngòi Tha,21.82451380040969,105.0087458,"R2F5+RF Yên Bình District, Yên Bái, Vietnam",565
Ngô Mây,14.002632699790423,109.0601098,"2336+22M, QL1A, TT. Ngô Mây, Phù Cát, Bình Định, Vietnam",566
Ngưu Trung,19.672408000356143,105.7942718,"MQCV+XP Quảng Xương District, Thanh Hoa, Vietnam",567
Nguyên Bình,22.650201700395687,105.9599369,"MX25+2X5, Nguyên Bình, Nguyên Bình District, Cao Bang, Vietnam",568
Nhà Bàng,10.61881569947284,105.001055,"J292+GCV, QL91, TT. Nha Bàng, Thị xã Tịnh Biên, An Giang, Vietnam",569
Nhà Bè,10.70121089947814,106.7390089,"11/5 D. Cát Lợi, TT. Nhà Bè, Nhà Bè, Thành phố Hồ Chí Minh, Vietnam",570
Nhà Mát,9.213437499407105,105.7403723,"đường Bạch Đằng, Phường Nhà Mát, Bạc Liêu, Vietnam",571
Nham Biền,21.201829400407448,106.2464193,"267 Tiểu Khu 3, Tiểu khu 3, Yên Dũng, Bắc Giang, Vietnam",572
Nhã Nam,21.444170900409627,106.0976533,"C3VW+VX3, Unnamed, Road, Tân Yên, Bắc Giang, Vietnam",573
Nhân Thịnh,20.5512963003934,106.1493182,"H42X+CHV, Đê sông Hồng, Nhân Thịnh, Lý Nhân, Hà Nam, Vietnam",574
Nhơn Hòa,13.544113299738427,108.0947492,"G3VV+JV Chư Pưh District, Gia Lai, Vietnam",575
Nho Quan,20.321651300385646,105.7508104,"8QC2+H62, Hoè thị, Nho Quan, Ninh Bình, Vietnam",576
Như Nhật,18.24944280025588,106.1829298,"65XM+M4P, Thắng Lợi, Kỳ Anh, Hà Tĩnh, Vietnam",577
Như Quỳnh,20.983211000404044,105.9804159,"XXMJ+445, TT. Như Quỳnh, Văn Lâm, Hưng Yên, Vietnam",578
Ninh Cường,20.199359300380934,106.2058389,"56X4+P9R, Đạo Đường, Trực Ninh, Nam Định, Vietnam",579
Ninh Gia,11.631562499548032,108.27190319999998,"J7JC+PM4, QL20, Ninh Gia, Đức Trọng, Lâm Đồng, Vietnam",580
Ninh Giang,20.73502850039856,106.3905944,"177 Nguyễn Lương Bằng, Đồng Tâm, Ninh Giang, Hải Dương, Vietnam",581
Ninh Hòa,12.49343789962732,109.1270865,"F4VG+9VC, TT. Ninh Hòa, Ninh Hòa, Khánh Hòa, Vietnam",582
Ninh Kieu District,10.028165299439395,105.7652116,"2QH8+84H, Xuan Khanh, Ninh Kiều, Cần Thơ, Vietnam",583
Nông Cống,19.626195000353626,105.6499863,"06 Trần Phú, Minh Thọ, Nông Cống, Thanh Hoá, Vietnam",584
nông trường 718A,12.75644089965384,108.8113923,"QR46+HH M'Đrăk District, Dak Lak, Vietnam",585
nông trường Ea Pốc,12.784170799656692,108.0745583,"Q3MF+MR Cư M'gar District, Dak Lak, Vietnam",586
North Van Phong,12.710677599649154,109.3813025,"P96J+3PF TDC Vĩnh Yên xã Vạn Thạnh, Vạn Thạnh, Vạn Ninh, Khánh Hòa, Vietnam",587
N'Thol Hạ,11.760120499559042,108.3248237,"Q86F+2W Đức Trọng District, Lam Dong, Vietnam",588
Nưa,19.747113500360097,105.6391807,"PJWQ+MJX, khu phố 9, Triệu Sơn, Thanh Hoá, Vietnam",589
Núi Đèo,20.9195013004028,106.6676221,"WMC8+2VH, Thủy Sơn, Thủy Nguyên, Hai Phong, Vietnam",590
Núi Đối,20.75368600039904,106.6595202,"QM35+6FJ, Thanh Sơn, Kiến Thụy, Hai Phong, Vietnam",591
Núi Sập,10.264361199451788,105.26679289999998,"226 Đường Nguyễn Văn Trỗi, TT. Núi Sập, Thoại Sơn, An Giang, Vietnam",592
Núi Thành,15.434206199958544,108.65592599999998,"CMM4+Q8H, TT. Núi Thành, Núi Thành District, Quảng Nam, Vietnam",593
Nước Hai,22.735792800393146,106.1558931,"P5P4+78Q, TT. Nước Hai, Hòa An District, Cao Bang, Vietnam",594
Nước Sốt,18.43552690027149,105.2220678,"C6PC+6VH, Sơn Kim 1, Hương Sơn, Ha Tinh, Vietnam",595
Óc Eo,10.25442069945124,105.15611029999998,"7534+QCX, Nguyễn Thị Hạnh, TT. Ocs Eo, Thoại Sơn, An Giang, Vietnam",596
O Mon District,10.11353459944372,105.62076570000002,"4J7C+M5X, Khu Vực 3, Ô Môn, Cần Thơ, Vietnam",597
Pác Miầu,22.834470100389964,105.49389689999998,"RFMV+PJV, Thị trấn Pác Miầu, Bảo Lâm District, Cao Bằng, Cao Bang, Vietnam",598
Pắc Quang,22.37282150040254,106.3128726,"98F7+44 Tràng Định District, Lạng Sơn, Vietnam",599
Pa Tần,22.464340300400515,103.1976055,"F57W+9WW, Pa Tần, Sìn Hồ District, Lai Chau, Vietnam",600
Phan Rí Cửa,11.17295649951135,108.56689989999998,"1 Hai Bà Trưng, Phan Rí Cửa, Tuy Phong, Bình Thuận, Vietnam",601
Phat Diem,20.090173600376392,106.0834949,"52 Phú Vinh, TT. Phát Diệm, Kim Sơn, Ninh Bình, Vietnam",602
Phiêng Lanh,21.640513000410177,103.634521,"JJRM+3RM, TL107, Mường Giàng, Quỳnh Nhai, Sơn La, Vietnam",603
Phố Bảng,23.25309660037352,105.1851227,"753M+5QC, Đường Không Tên, TT. Phó Bảng, Đồng Văn, Hà Giang, Vietnam",604
Phố Châu,18.51162450027767,105.4235279,"97 Đ. Ng. Tuấn Thiện, TT. Phố Châu, Hương Sơn, Hà Tĩnh, Vietnam",605
Phố Lu,22.32070360040359,104.1865508,"85CP+6PV, TT. Phố Lu, Bảo Thắng, Lào Cai, Vietnam",606
Phong Châu,21.40368580040938,105.3144032,"518 QL2, TT. Phong Châu, Phù Ninh, Phú Thọ, Vietnam",607
Phong Điền,9.997527999437883,105.667298,"XMX8+3X2, Phan Văn Trị, Nhơn ái, Phong Điền, Cần Thơ, Vietnam",608
Phong Điền,16.5819269000902,107.3654347,"34 Phò Trạch, TT. Phong Điền, Phong Điền, Thừa Thiên Huế, Vietnam",609
Phong Nha,17.61186670019752,106.3049384,"J864+M4V, Phong NHA, Bố Trạch District, Quang Binh Province, Vietnam",610
Phong Sơn,20.213491700381496,105.47393069999998,"6F7F+9JX, TT. Cẩm Thuỷ, Cẩm Thuỷ, Thanh Hoá, Vietnam",611
Phong Tho,22.545443900398528,103.2896149,"G7WQ+GV4, TT. Phong Thổ, Phong Thổ, Lai Châu, Vietnam",612
Phồn Xương,21.479091400409807,106.1256663,"F4HG+M5P, TT. Cầu Gồ, Yên Thế District, Bac Giang, Vietnam",613
Phố Ràng,22.23541860040513,104.477024,"08 Võ Nguyên Giáp, TT. Phố Ràng, Bảo Yên, Lào Cai 330000, Vietnam",614
Phổ Yên,21.41409930040945,105.8725311,"812 QL3, Ba Hàng, Phổ Yên, Thái Nguyên, Vietnam",615
Phúc Thọ,21.10835680040616,105.5423115,"4G5R+8M8, TT. Phúc Thọ, Phúc Thọ, Hanoi, Vietnam",616
Phù Cưu,20.70536500039779,106.2675932,"P749+42 Ninh Giang District, Hai Duong, Vietnam",617
Phú Đa,16.439858900074427,107.71534389999998,"28 Đỗ Tram, Phú Đa, Phú Vang, Thừa Thiên Huế, Vietnam",618
Phú Hải Trong,16.311219900059985,108.03074499999998,"826J+F7 Phú Lộc, Thua Thien Hue, Vietnam",619
Phú Hòa,14.098365999801464,107.97124399999998,"27 Trần Phú, TT. Phú Hoà, Chư Păh, Gia Lai, Vietnam",620
Phú Hòa,15.436654199958838,108.4652158,"CFP8+V5, Tam Sơn, Núi Thành District, Quảng Nam, Vietnam",621
Phú Hòa,13.019835199681332,109.2124432,"2697+R2W, QL25, TT. Phú Hòa, Phú Hòa, Phú Yên, Vietnam",622
Phú Hòa,15.957503300019598,107.9531336,"XX53+28F, Đông sơn, Đông Giang, Quảng Nam, Vietnam",623
Phú Hòa,10.359671899457163,105.37764269999998,"113/5B ĐT943, Ấp Phú Hữu, Thoại Sơn, An Giang, Vietnam",624
Phú Hội,11.688453999552868,108.34337220000002,"21 Thống Nhất, Phú Hội, Đức Trọng, Lâm Đồng, Vietnam",625
Phu Hung,11.911151399572358,107.003231,"Dt, W263+C9J, Phú Nghĩa, Bù Gia Mập, Bình Phước, Vietnam",626
Phu Lam,13.05773869968536,109.3152204,"92 Nguyễn Thị Định, Phú Thạnh, Tuy Hòa, Phú Yên, Vietnam",627
Phú Liên,19.089617900320626,105.6910804,"3MQR+WJR, Quỳnh Long, Quỳnh Lưu District, Nghe An, Vietnam",628
Phú Lộc,9.42767269941399,105.73616169999998,"CPHP+3F Thạnh Trị District, Soc Trang, Vietnam",629
Phú Lộc,16.28035100005649,107.858984,"116 Lý Thánh Tông, tt. Phú Lộc, Phú Lộc, Thừa Thiên Huế, Vietnam",630
Phú Long,10.97052159949652,108.1450021,"81 Đường Phú Long, TT. Phú Long, Hàm Thuận Bắc, Bình Thuận, Vietnam",631
Phú Minh,20.78153700039972,105.91731,"139 Cầu Chui Vạn Điểm, TT. Phú Minh, Phú Xuyên, Hà Nội, Vietnam",632
Phu My,10.57910789947034,105.3621313,"758 Đ. Chu Văn An, TT. Phú Mỹ, Phú Tân, An Giang, Vietnam",633
Phu My,14.175231599810376,109.05230489999998,"53G2+5WC, Chu Văn An, TT. Phù Mỹ, Phù Mỹ, Bình Định, Vietnam",634
Phú Mỹ,10.588227399470908,107.0583976,"1 Đường Tôn Thất Tùng, TT. Phú Mỹ, Tân Thành, Bà Rịa - Vũng Tàu, Vietnam",635
Phùng,21.085967200405804,105.6652516,"151, Đình Thượng/5 Phan Đình Phùng, Đan Phượng, Hà Nội, Vietnam",636
Phu Nhuan District,10.800118199484707,106.6770417,"67/14 Trần Khắc Trân, Phường 9, Phú Nhuận, Thành phố Hồ Chí Minh, Vietnam",637
Phước An,12.710006499649085,108.3138426,"01 Nguyễn Thượng Hiền, Phước An, Krông Pắc, Đắk Lắk, Vietnam",638
Phước Bửu,10.532452899467446,107.4048791,"34 Đ. Trần Văn Trà, TT. Phước Bửu, Xuyên Mộc, Bà Rịa - Vũng Tàu, Vietnam",639
Phước Cát,11.56590669954253,107.3123752,"H886+9V5 Ngã Tư Cây Gòn Phước Cát 1, Phước Cát 1, Cát Tiên, Lâm Đồng, Vietnam",640
Phước Dân,11.528010699539392,108.9270864,"GWHH+25M, ĐT703, TT. Phước Dân, Ninh Phước, Ninh Thuận, Vietnam",641
Phước Điền,14.769855199880087,109.0134382,"Q297+W9 Đức Phổ District, Quang Ngai, Vietnam",642
Phước Hải,10.427955999461147,107.2953204,"C7HV+7XG, Đ. Nguyễn Bá Ngọc, Phước Hải, Đất Đỏ, Bà Rịa - Vũng Tàu, Vietnam",643
Phước Hảo,15.564968699973903,107.8558617,"HV74+X8 Nông Sơn District, Quảng Nam, Vietnam",644
Phước Lộc Đông,15.173069699927744,108.66810850000002,"Thôn Minh Mỹ, 5MF9+46C, Tịnh Bắc, Sơn Tịnh, Quảng Ngãi, Vietnam",645
Phuoc Long,11.833106899565427,106.98728889999998,"985 ĐT741, Sơn Giang, Phước Long, Bình Phước, Vietnam",646
Phước Long,9.436498399414296,105.4638192,"Ấp Nội Ô, CFP7+MJ7, Phước Long, Bạc Liêu, Vietnam",647
Phước Mỹ Trung,10.19044649944777,106.27184490000002,"57RC+3M2 UBND huyện Mỏ Cày Bắc, 882, Phước Mỹ Trung, Mỏ Cày Bắc, Bến Tre, Vietnam",648
Phước Vĩnh,11.291977099520471,106.79538979999998,"11 Hùng Vương, TT. Phước Vĩnh, Phú Giáo, Bình Dương, Vietnam",649
Phường 3,11.891457099570603,108.4720508,"VFRC+HR Thành phố Đà Lạt, Lâm Đồng, Vietnam",650
Phương Hạ,17.547599900191255,106.52795299999998,"GGXH+25 Bố Trạch District, Quang Binh Province, Vietnam",651
Phương Lâm,20.81666700040055,105.333333,"439 Đà Giang, Phư Lâm, Hòa Bình, Vietnam",652
Phương Xá,21.47092660040977,105.0812834,"F3CJ+9FG, Phương Xá, Cẩm Khê District, Phu Tho Province, Vietnam",653
Phú Phong,13.908636863418078,108.92273186445716,"23 QL19B, Tây Xuân, Tây Sơn, Bình Định, Vietnam",654
Phú Phong,13.91082919977989,108.92154689999998,"163 Trần Quang Diệu, TT. Phú Phong, Tây Sơn, Bình Định, Vietnam",655
Phú Quý,10.516599999466472,108.93292,"GW8M+G6P, Quý Thạnh, Phú Quý, Bình Thuận, Vietnam",656
Phú Riềng,11.660587299550496,106.90092939999998,"MW62+7FJ, Phú Riềng, Bù Gia Mập District, Binh Phuoc, Vietnam",657
Phú Thái,20.963172900403663,106.5095329,"188 Trần Hưng Đạo, TT. Phú Thái, Kim Thành, Hải Dương, Vietnam",658
Phú Thiện,13.527083699736531,108.3163233,"46 Đường Trần Phú, TT. Phú Thiện, Phú Thiện, Gia Lai, Vietnam",659
Phú Thịnh,15.551755999972356,108.4144562,"HC27+HQV, Tam Vinh, Phú Ninh District, Quảng Nam, Vietnam",660
Phú Thọ,21.400004700409355,105.2238899,"132 Phú An, Ph.Phong Châu, Phú Thọ, Vietnam",661
Phú Thọ,11.548622599541096,109.0281472,"31 Hải Thượng Lãn Ông, Đông Hải, Phan Rang-Tháp Chàm, Ninh Thuận, Vietnam",662
Phủ Thông,22.273137000404468,105.879434,"7VFH+5WH, QL3, TT. Phủ Thông, Bạch Thông, Bắc Kạn, Vietnam",663
Phú Thứ,12.999392899679163,109.2395594,"645, Hoà Bình 2, Tây Hòa, Phú Yên, Vietnam",664
Phú Thứ,21.022043600404743,106.5606112,"61 ĐT388, Phú Thứ, Kinh Môn, Hải Dương, Vietnam",665
Phú Túc,13.197702399700374,108.68550949999998,"5MXP+47V, Hùng Vương, TT. Phú Túc, Krông Pa, Gia Lai, Vietnam",666
Phú Túc,11.083216499504667,107.2117674,"36M6+RQ8, Phú Túc, Định Quán District, Dong Nai, Vietnam",667
Phú Vang,13.132875799693393,109.27608159999998,"47JG+WGH, Nguyễn Tất Thành, Bình Kiến, Tuy Hòa, Phú Yên, Vietnam",668
Phú Viên,19.756386700360576,105.8436791,"QR4V+MF3, Phố Phú Quý, phường, Quảng Xương, Thanh Hoá, Vietnam",669
Phú Việt,17.261603800162607,106.7992982,"7Q6X+JP Lệ Thủy District, Quang Binh Province, Vietnam",670
Phu Xuyen,20.748180900398893,105.9110996,"PWX6+6G3, QL1A, TT. Phú Xuyên, Phú Xuyên, Hà Nội, Vietnam",671
Phù Yên,21.258397300408102,104.6435277,"7J5V+957, TT. Phù Yên, Phù Yên District, Son La, Vietnam",672
Pingmeng,22.946896900386005,105.9927854,"WXXV+2HP, Napo County, Baise, Guangxi, China",673
Plei Cần,14.707203999872691,107.6946733,"726 Hùng Vương, TT. Plêi Cần, Ngọc Hồi, Kon Tum, Vietnam",674
Plei Mơ Nang,14.065878799797714,107.9662899,"3X88+9G Chư Păh District, Gia Lai, Vietnam",675
Plei Nhao,13.911985599780024,108.0090809,"1099 Trường Chinh, Chư HDrông, Thành phố Pleiku, Gia Lai, Vietnam",676
Plei Tu,13.454725899728496,107.8630969,"FV37+V6 Chư Prông District, Gia Lai, Vietnam",677
Plei Ya Rê,14.272643799821704,107.696219,"7MFW+3F Sa Thầy District, Kon Tum, Vietnam",678
Prao,15.924361500015769,107.6486278,"WJFX+QGG, Thôn Gừng, Đông Giang, Quảng Nam 565510, Vietnam",679
